{
  "validation_id": "val_2026_000001",
  "target_type": "DocumentInstance",
  "target_id": "doc_abc123",
  "context": {
    "actor_id": "svc_ingest",
    "scope": "uo_rh",
    "timestamp_rfc3339": "2026-06-03T14:00:00Z",
    "engine_version": "0.3.0"
  },
  "overall_status": "passed",
  "outcomes": [
    {
      "rule_id": "validation.hash.sha256_format",
      "status": "passed"
    }
  ]
}
